{
  "schemaVersion": "1.0.0",
  "manifestId": "STUDIO-3D-DELIVERY-KAP-PENDING-R1",
  "projectId": "PROJECT-KAP-OPENING-2026",
  "eventId": "EVENT-KAP-OPENING-2026",
  "venueId": "VENUE-KAP-001",
  "sourceId": null,
  "authority": "unknown",
  "filename": null,
  "format": null,
  "hash": null,
  "size": null,
  "version": null,
  "software": null,
  "softwareVersion": null,
  "renderEngine": null,
  "plugins": [],
  "destinationId": null,
  "sceneId": null,
  "dayVariant": [],
  "personaVariant": [],
  "cameraId": null,
  "cameraPosition": null,
  "cameraHeight": null,
  "cameraHeading": null,
  "fieldOfView": null,
  "northDirection": null,
  "units": null,
  "scale": null,
  "origin": null,
  "coordinateReference": null,
  "dimensions": null,
  "textureDependencies": [],
  "rightsStatus": "unknown",
  "approvalStatus": "unknown",
  "optimizationStatus": "unknown",
  "spatialRegistrationStatus": "unknown",
  "navmeshStatus": "unknown",
  "collisionStatus": "unknown",
  "projectionMappingStatus": "unknown",
  "missingDependencies": [],
  "warnings": [
    "قالب استلام فقط؛ لا يحتوي بانوراما أو نموذجًا ثلاثي الأبعاد."
  ],
  "sourceInventory": null
}
